{
  "SchemaVersion": "1",
  "Operation": "create",
  "AppointmentId": "538525b6-20a1-4889-9923-05921a91cf19",
  "CreatedAt": "2027-09-20T17:32:08+03:00",
  "Source": "La sediu",
  "ScheduledAt": "2027-09-22T11:15:00+03:00",
  "ScheduledLocalDate": "2027-09-22",
  "ScheduledLocalTime": "11:15",
  "DurationMinutes": 15,
  "BranchId": "1602b1b4-930f-498f-997a-4b0b2569f936",
  "BranchName": "ScanExpert Brașov",
  "Modality": "Ecografie",
  "ProductId": "78063f3c-55c1-4c2d-ac8e-152baf776d17",
  "ProductCode": "TEST-ECO-001",
  "ProductName": "Ecografie mamară bilaterală",
  "Laterality": "bilateral",
  "Payer": "Asigurator privat",
  "Insurer": "TEST Asigurator Exemplu",
  "ReferralDate": "",
  "ReferralPending": false,
  "ReferralNumber": "",
  "ReferringDoctorName": "",
  "ReferringDoctorClinic": "",
  "ReferringDoctorParafa": "",
  "PatientId": "667e94a6-6564-49e9-941f-a60b1e9615d6",
  "PatientFullName": "TEST GEORGESCU ELENA",
  "PatientLastName": "",
  "PatientFirstName": "",
  "PatientCnp": "6010719080038",
  "PatientPhone": "+40700000003",
  "PatientBirthDate": "2001-07-19",
  "PatientSex": "F",
  "Notes": "Date fictive de test. Solicită programare dimineața."
}
