{
  "SchemaVersion": "1",
  "Operation": "create",
  "AppointmentId": "33d045d2-dc16-474a-bdf3-d7fb888ddf4e",
  "CreatedAt": "2027-06-08T08:05:10+03:00",
  "Source": "Aplicație",
  "ScheduledAt": "2027-06-10T14:00:00+03:00",
  "ScheduledLocalDate": "2027-06-10",
  "ScheduledLocalTime": "14:00",
  "DurationMinutes": 20,
  "BranchId": "ab46eeca-7bcc-4275-aed3-4b158930a5bf",
  "BranchName": "ScanExpert Iași",
  "Modality": "CT",
  "ProductId": "9c85f655-e4fb-41f1-91ff-7cf49dad3fc1",
  "ProductCode": "TEST-CT-001",
  "ProductName": "CT torace nativ",
  "Laterality": "",
  "Payer": "Contra cost",
  "Insurer": "",
  "ReferralDate": "",
  "ReferralPending": false,
  "ReferralNumber": "",
  "ReferringDoctorName": "",
  "ReferringDoctorClinic": "",
  "ReferringDoctorParafa": "",
  "PatientId": "cf1fa52a-c082-4f53-8383-ebc8f106f255",
  "PatientFullName": "TEST IONESCU MARIA",
  "PatientLastName": "",
  "PatientFirstName": "",
  "PatientCnp": "2921103220020",
  "PatientPhone": "+40700000002",
  "PatientBirthDate": "1992-11-03",
  "PatientSex": "F",
  "Notes": ""
}
