{
  "SchemaVersion": "1",
  "Operation": "create",
  "AppointmentId": "2d3f9dbf-7c78-4be9-9bb5-4ca69a20f8b2",
  "CreatedAt": "2027-04-19T16:40:00+03:00",
  "Source": "Centrala",
  "ScheduledAt": "2027-04-20T08:00:00+03:00",
  "ScheduledLocalDate": "2027-04-20",
  "ScheduledLocalTime": "08:00",
  "DurationMinutes": 45,
  "BranchId": "c6b6bb68-97d6-43c6-a9d7-b6d89484f719",
  "BranchName": "OptimDiagnostic Botoșani",
  "Modality": "RMN",
  "ProductId": "675adc55-a117-41c2-995f-f23da4748a7b",
  "ProductCode": "TEST-RMN-002",
  "ProductName": "RMN umăr",
  "Laterality": "dreapta",
  "Payer": "Monitor",
  "Insurer": "",
  "ReferralDate": "",
  "ReferralPending": true,
  "ReferralNumber": "",
  "ReferringDoctorName": "TEST DR. STAN MIHAI",
  "ReferringDoctorClinic": "TEST Spital Exemplu",
  "ReferringDoctorParafa": "T00002",
  "PatientId": "220031ca-9e5d-4fa1-914f-09aad72c3b7e",
  "PatientFullName": "TEST DUMITRESCU ANDREI",
  "PatientLastName": "",
  "PatientFirstName": "",
  "PatientCnp": "1580125070041",
  "PatientPhone": "+40700000004",
  "PatientBirthDate": "1958-01-25",
  "PatientSex": "M",
  "Notes": "Date fictive de test. Biletul de trimitere nu a sosit încă."
}
