{
  "SchemaVersion": "1",
  "Operation": "create",
  "AppointmentId": "232b0d5d-4321-465f-8533-e25bb5fba40b",
  "CreatedAt": "2027-03-01T10:12:45+02:00",
  "Source": "Centrala",
  "ScheduledAt": "2027-03-15T09:30:00+02:00",
  "ScheduledLocalDate": "2027-03-15",
  "ScheduledLocalTime": "09:30",
  "DurationMinutes": 30,
  "BranchId": "031a3679-baef-4850-a479-0aedede5e12c",
  "BranchName": "ScanExpert Galați",
  "Modality": "RMN",
  "ProductId": "ff6b4dcb-5596-4674-9086-47fe8aea1b85",
  "ProductCode": "TEST-RMN-001",
  "ProductName": "RMN genunchi",
  "Laterality": "stanga",
  "Payer": "CAS",
  "Insurer": "",
  "ReferralDate": "2027-02-26",
  "ReferralPending": false,
  "ReferralNumber": "",
  "ReferringDoctorName": "TEST DR. IONESCU ANA",
  "ReferringDoctorClinic": "TEST Cabinet Medical Exemplu",
  "ReferringDoctorParafa": "T00001",
  "PatientId": "0cb400ae-ce13-41c9-b8e6-ac4b05e791d9",
  "PatientFullName": "TEST POPESCU ION",
  "PatientLastName": "TEST POPESCU",
  "PatientFirstName": "ION",
  "PatientCnp": "1850412170013",
  "PatientPhone": "+40700000001",
  "PatientBirthDate": "1985-04-12",
  "PatientSex": "M",
  "Notes": "Date fictive de test. Pacientul aduce CD cu investigația anterioară."
}
