{
  "SchemaVersion": "1",
  "Operation": "create",
  "AppointmentId": "79631e39-f7df-4761-bc15-6f3a5bf237ec",
  "CreatedAt": "2027-12-01T13:20:31.482913Z",
  "Source": "",
  "ScheduledAt": "2027-12-06T08:45:00Z",
  "ScheduledLocalDate": "2027-12-06",
  "ScheduledLocalTime": "10:45",
  "DurationMinutes": 0,
  "BranchId": "17fb9c08-3789-4060-a681-896a6e93bf23",
  "BranchName": "ScanExpert Timișoara",
  "Modality": "",
  "ProductId": "",
  "ProductCode": "",
  "ProductName": "Consult ecografic",
  "Laterality": "",
  "Payer": "",
  "Insurer": "",
  "ReferralDate": "",
  "ReferralPending": false,
  "ReferralNumber": "",
  "ReferringDoctorName": "",
  "ReferringDoctorClinic": "",
  "ReferringDoctorParafa": "",
  "PatientId": "bc9ef5d3-add7-4921-9867-2ff046411e2d",
  "PatientFullName": "TEST STAN VASILE",
  "PatientLastName": "",
  "PatientFirstName": "",
  "PatientCnp": "",
  "PatientPhone": "+40700000005",
  "PatientBirthDate": "",
  "PatientSex": "",
  "Notes": "Date fictive de test. Pacientul nu a comunicat CNP-ul."
}
